{"attempt_id":"attempt-p0-001","domain_separated_content_sha256":"b3c0dcb4761803f1e5149f3afebc3279d8b6ac571777712ca10e438c04d19ee1","host_framing_status":"framed","lifecycle":"PostToolUse","observation_status":"observed","observed_at_ms":42,"receipt_id":"observe-p0-001","result_utf8_bytes":26,"schema_version":"v1","session_id":"session-p0-001","tool_name":"Read","tool_use_id":"tooluse-p0-001"}
